J,J,J,J,J,J,DJ,DJ,DJ,DJ,DJ,DJ
ARIZONA,"STARTS WITH ""A""",FOOD & DRINK,MODERN HISTORY,COLLEGES,SINGING GEMS,RELIGION,THE CARIBBEAN,INSECTS,REPUBLICANS,NUCLEAR PHYSICS,ORSON WELLES
Phoenix,automatic,a chuck wagon,Adolf Hitler,the University of Illinois,Pearl Bailey,a guru,the Atlantic,a honeycomb,Dulles,a cyclotron,wine
Barry Goldwater,alleged,sugar,the Treaty of Versailles,Moscow State University,Ruby,genuflect,the Virgin Islands (or Puerto Rico),a larva (caterpillar),Tennessee,electricity,magic
Flagstaff,,,an earthquake,Thomas Jefferson,"""Rhinestone Cowboy""",Reverend Robert Schuller,the Bahamas,termites,the only women senators,the NRC (Nuclear Regulatory Commission),Rita Hayworth
The Adventures of Rin Tin Tin,,,the Common Market,Annapolis (U.S. Naval Academy),The Diamonds,Buddhism,cannibal,the legs,J. Strom Thurmond,control rods,Macbeth
Sun City,,,Juan Peron,Vassar,The Sapphires,the Salvation Army,Barbados,the kissing bug,Everett Dirksen,,25
