J,J,J,J,J,J,DJ,DJ,DJ,DJ,DJ,DJ
UP ABOVE,POP MUSIC,WHAT THE DICKENS!,JAILHOUSE ROCK,"DAD, GUM IT",WE'LL SPOT YOU A LETTER,SCULPTURE,ROBIN WILLIAMS MOVIE QUOTES,THE NAME OF THE LAW,THAT'S MISLEADING,BRIDGE ON THE RIVER,KAUAI
"To be superior is to be this shampoo brand ""above the rest""","Before she was an independent woman, Beyoncé was part of this group that hit with ""Independent Women, Pt. 1""","Charles Dickens called this decorated yuletide item a ""pretty German toy""",Al Capone & Machine Gun Kelly did time on this rock in San Francisco Bay,Nicorette is a gum designed to help your dad stop doing this,"Last letter Y: It ""breeds contempt""","As opposed to a full statue, this type of sculpture shows only the head & shoulders of a person","""Time to rock it from the delta to the DMZ!""",The handgun act named for this man was signed into law in 1993,A young goat's daytime snooze,Southwark Bridge,"Dress appropriately if you visit Mount Waialeale, which gets more than 30 feet of this a year"
"Rumors led Caesar to divorce his wife, who we now proverbially say ""must be above"" this","In 2021 she became the youngest artist to debut at No. 1 on the Hot 100 with her song ""drivers license""","""The Parish Boy's Progress"" is the subtitle of this 1838 novel",From 1964 to 1982 this Nobelist was incarcerated on rocky Robben Island off the coast of Cape Town,"Born Frances Gumm, she made her singing debut at age 2 in her dad's theater & then went on to visit Oz",First letter H: A small village,c. 1415 Donatello sculpted a relief of St. George slaying this mythical beast,"""My first day as a woman, I'm getting hot flashes""",1998's Copyright Term Extension Act was named for this late congressman who penned a 1965 No. 1 pop hit,Eyed an equine,Old Vicksburg Bridge,"The most green of Hawaii's islands, Kauai is nicknamed this ""Isle"", reflecting its botanical bounty"
"In film budgeting, writers, producers & talent are idiomatically considered this","In 1988 Tracy Chapman had a hit with this auto tune; 35 years later, Luke Combs' cover of it is a country hit",This title character  becomes a successful author & marries Dora Spenlow,The infamous penal colony on this rocky islet off the coast of South America opened in 1852,"When a man with this last name offered gum with his dad's baking powder, it started a chewing gum empire","Third letter V: The conditional agreement made to humanity by God, as revealed in scripture","This famous statue of Aphrodite, now in the Louvre, was discovered on an island in the Aegean in 1820","""Look at me, son.  It's not your fault""",A tariff act named for Smoot & this congressman raised import duties to protect U.S. businesses,"Hey, yellow fruit, leave, just get on out of here, dig?",The O'Connell & Seán O'Casey Bridges,One look at Waimea Canyon & you'll see why it's called this of the Pacific after a mainland natural wonder
"To hang suspended in place above something, like a helicopter","(I'm Hans Zimmer.)  Before scoring films I could be seen tickling the ivories on this new wave classic by The Buggles, the first ever video on MTV",Nell Trent's grandfather runs the title establishment at the opening of this novel,Kurdish nationalist Abdullah Öcalan is an inmate held on this country's rocky island of Imrali,"This ""colorful"" gum-chewing girl has a golden ticket that gets her & her dad in to see Willy Wonka","Sixth letter G: Phosphorescence, or the pleasant remembrance of past glory","In this movement, which is French for ""hobby horse"", sculptures are made of such items as machine parts","""You treat a disease, you win, you lose. You treat a person, I guarantee you, you'll win""","The Hate Crimes Prevention Act of 2009 was named for James Byrd Jr. & this Casper, Wyoming man",A perch rolls strikes & spares,"The 3,580-foot-long Peace Bridge",Kauai & its small neighbor Niihau were the only Hawaiian islands not conquered by this king
"Wordsworth wrote, ""Lines composed a few miles above..."" this place","Ice Spice & this singer whose fans are called Barbz are fittingly on the ""Barbie"" soundtrack with ""Barbie World""","He takes Charles Darnay's place at the scaffold in ""A Tale of Two Cities""","This chateau on a tiny rock in the Mediterranean was a prison in real life, not just in ""The Count of Monte Cristo""","Gumby's father has this name, from a Bantu word for ""okra""",First letter P: These wavelike contractions move food through the digestive tract,In 1937 this British sculptor said that he associated the openings in his hole-y works with caves,"""Boys, you must strive to find your own voice""","Named for an Illinois representative, 1910's White Slave Traffic Act is better known as this ""Act""",Paintings seen along the sloping path for wheelchairs,Prague's Charles Bridge,"In the movie version of ""South Pacific"", Kauai's beautiful North Shore was used as this exotic isle"
