J,J,J,J,J,J,DJ,DJ,DJ,DJ,DJ,DJ
ON STATES' HIGHWAY WELCOME SIGNS,THEIR NAME'S A BIBLE BOOK,POTENT QUOTABLES,TV COACHES,"IT'S ALL ""SMALL"" STUFF",HEAVY,NATIONAL STATUARY HALL,AWARDS & HONORS,PLANT LORE,GEOGRAPHIC BOOK TITLES,POP,THE QUESTION?
Delaware,Ruth,wine,Ted Lasso,the small intestine,the Titanic,Eisenhower,Best in Show,fairy,James Bond,Miley Cyrus,Why the long face?
Iowa,Jude,champagne,Glee,small claims court,the crown,Fulton,white blood cells,cedar,Brooklyn,LeBron James,Are you ready for some football?
"""Sweet Home Alabama""",Joel,a martini,Patrick,small fry,a bale,habeas corpus,Olympic medals,a leek,The Last King of Scotland,Con Air,Am I my brother's keeper?
Bienvenue,Joshua,whiskey,New Girl,the small of her back,Joe Louis,Kamehameha & Father Damien,Yale,chestnuts,Dr. Mengele,Kratos,How do I love thee?
Great Lakes,Jonah,yo-ho-ho and a bottle of rum,Kyle Chandler,the Small Business Administration,a St. Bernard,John C. Calhoun,the American Theatre Wing,Advent,Congo,Jason Reitman,who watches the watchers (watchmen)
