J,J,J,J,J,J,DJ,DJ,DJ,DJ,DJ,DJ,TJ,TJ,TJ,TJ,TJ,TJ
"ABOVE, BELOW OR INTERSECTED BY THE EQUATOR",FIX THE MOVIE QUOTE,PRIDE & POTUS,FAILING HISTORY,NAME DROPPERS,MIXED GREENS,LIBRARIES,"OH, BROTHER!",SNEAKER BRANDS,AMERICAN BRIDGES,THE NOBEL PRIZE,BY THE NUMBERS,FUNGUS AMONG US,OLD POP MUSIC HAD SOME VOWELS: E-I-E-I-O,FOODS NAMED AFTER PEOPLE,SCULPTURES,SIGMUND FREUD,"PLEASE, ANYTHING BUT ""MATH"""
above,Houston,Joe Biden,Christopher Columbus,Dunkin',shamrock,September,Cain & Abel,Converse,Philadelphia,Al Gore,411,mushrooms,"""Genie In A Bottle""",an avocado,Goliath,a couch,an oath
below,Fight Club,President Obama,apartheid,Freedom fries,emerald,Gone With the Wind,Oasis,Nike,the George Washington Bridge,Economics,9 to 5,rust,One Direction,a graham cracker,a nose,the id,mash
intersected,Baby,1965,London,Cougar,Kermit the Frog,nipple,John Wilkes Booth,Adidas,Boston,Malala,What's your 20?,stonewashed denim,Celine Dion,Pavlova,a guitar,dreams,Mate
above,bears,Ronald Reagan,Henry VIII,quidditch,Statue of Liberty,Philip Roth,Uncut Gems,Puma,the Mississippi,Oslo,five-finger discount,The Last of Us,Debbie Gibson,General Tso's chicken,Chicago,libido,Bath
intersected by,Felicia,Gerald Ford,the Great Wall of China,Restoration Hardware,matcha,Amy Tan,the Kelce brothers (Jason & Travis Kelce),Vans,Michigan,laureate,86,the wood wide web,The Immaculate Collection,Sinatra,Andy Warhol,sometimes a cigar is just a cigar,Mach
