J,J,J,J,J,J,DJ,DJ,DJ,DJ,DJ,DJ
AT THE START OF THE SPORT,SECOND CITIES,ALL UP IN YOUR BUSINESS,WHAT A LITERARY CHARACTER,"CROSSWORD CLUES ""R""",PATIENCE,BOOKS IN HISTORY,MEDALS & DECORATIONS,9-LETTER WORDS,ACTING UP AT JUILLIARD,BIBLICAL GARB,PATIENTS
"Nomi-No-Sukune, considered the founder of this form of wrestling, is said to have won its first bout in 23 B.C.",The Castle of Good Hope dates to the 1660s in this city in South Africa,"It's the company that made the 717 for mass passengers as well as the F-22 Raptor for very, very specific passengers",This character who married Melanie instead of Scarlett O'Hara was said to have been based on Doc Holliday,Dial-up phone (6 letters),"For most, birthdays come once a year, except for those born on this date, who in a way, get older slower than the rest of us","Intellectuals change society in ""What Is to Be Done?"", an 1863 novel by Chernyshevsky that planted the seeds of this 1917 event",An Olympic gold medal is required to be at least 92.5% this metal & plated with a minimum of 6 grams of gold,"Fountains, Roman candles & ground spinners are types of these","Not long after graduating with Group 19 in 1990, this woman hit Broadway in ""Six Degrees of Separation""","At Jericho, this leader was told to ""loose thy shoe from off thy foot; for the place whereon thou standest is holy""",Barney Clark lived 112 days after becoming the first recipient of a permanent artificial this in 1982
"In 1883 an Englishman patented equipment for playing a form of this ""indoors, say upon a billiard or dining table""",It's home to the Borsa Italiana Stock Exchange,"Told, ""Take it to the house"" in an ad for this co. that ""knows home improvement"", Christian McCaffrey says, ""I will, that's where I live""","A 2023 movie was titled ""The Three Musketeers--Part I:"" this newcomer to Paris in the original 1844 novel",Type of sporting dog that makes fetch happen(9 letters),"Walter Mischel devised a test of kids' ability to delay gratification: eat one of these treats now, or be patient & get 2",Alfred Thayer Mahan changed military thinking with his 1890 work on this type of power that he said had made Britain dominant,Luminaries who have received this oldest U.S. military award still presented include Rod Serling & Sgt. Stubby the dog,Let's take a pregnant pause for this term of 3 months,"Group 1 included David Ogden Stiers, Patti LuPone & him, far from stupid as an Oscar winner for ""A Fish Called Wanda""","""Jonathan stripped himself of the robe that was upon him, and gave it to"" this friend & future king of Israel","In movies like ""The Notebook"", they're a cinematic technique; in PTSD patients, they're memories so vivid it's like reliving the event"
"Discovered in a pond in Scotland, the oldest known stone for this sport is inscribed with the date 1511",Froindlichst sells meatless patties in this German city on the Elbe,The split-adjusted share price of the 1986 IPO of this graphics software co. was 17 cents but here's an update; in 2023 it hit $634,"A handmaid in the Republic of Gilead, she lives in the home of the commander & his bitter wife Serena Joy","TR's cavalry in the Spanish-American War (5 letters, 6 letters)",Sculptor Gutzon Borglum chose this landmark for its solid granite rock face; it would take 14 years for it to be completed,"Economist F.A. Hayek's ""The Road to Serfdom"" came out in 1944 when this woman was at Oxford & was a huge influence on her later policies","Cuba's Order of Playa Giron, a beach near this bay, commemorates the 1961 victory over anti-Communist invaders","Found in Motrin, it's derived from propionic acid","This member of Group 30 in 2001 saw his career take off ""Marvelously"" as Falcon","For interpreting the handwriting on the wall, he was clothed ""with scarlet"" & given ""a chain of gold about his neck""","On July 6, 1885 Louis Pasteur took a bite out of this disease with a new vaccination for 9-year-old victim Joseph Meister"
"Long said to have invented baseball, this military man didn't, but he was definitely at Fort Sumter when the first shots were fired",This world capital is home to the Museum of Anatolian Civilizations,"After the investment bank of these brothers went Chapter 11 in 2008, retirement plans & investment funds took a $700 bil. hit","This fairy in ""A Midsummer Night's Dream"" causes no end of trouble with his mischievous deeds",Numbers game (8 letters),"On July 4, 1795 Paul Revere & Sam Adams buried one of these; a 1652 shilling was in the contents dug up 220 years later",This 5-word phrase about people in a different income bracket from you is the title of an 1890 Jacob Riis expose of NYC's slums,In 1912 Norway's King Haakon awarded this explorer & his crew the South Pole Medal,"This verb can mean to create through skill, or to construct a lie or forgery","A Tony for ""King Hedley II"" & an Oscar for ""Fences"" are part of this Group 22 woman's EGOT","John the Baptist wore a garment made of the hair of this animal while in the wilderness & eating ""locusts and wild honey""","A precursor to this compound, L-DOPA was used by Oliver Sacks to help bring Leonard L. out of 30 years of a coma-like condition"
These landmark boxing rules are named for the British nobleman who sponsored their 1867 publication,"The historic site Pedra do Sal in this second city  has been called ""the birthplace of samba""",This massive holding co. was not named for a single crowbar but from the 1929 merger of a Dutch co. with one run by British brothers,"In ""1984"", Julia meets with this man secretly, bringing him contraband chocolate & stirring forgotten memories",Japanese healing technique (5 letters),"Disappointed in March 1942, this military man said, ""I shall return""; happier on Oct. 20, 1944, he said, ""I have returned""",This Dutch scholar put out a 1516 translation of the Bible that made it more accessible & helped lead to the Reformation,The Netherlands' Order of the House of Orange in 1905 & the Bronze Cross in 1940 were both created by this queen,"You could ""transcend blockchain barriers"" at 2023's Icon Hyperbuild, this type of event for computer programmers","Alum Robin Williams set up a scholarship won by this woman, who made it from Group 32 to the lead in ""Zero Dark Thirty""",In several verses this uncomfortable goat hair fabric is worn with ashes as a sign of mourning,"Taken from her unknowingly, the immortal line of HeLa cells were named in honor of this woman who died of cancer in 1951"
