J,J,J,J,J,J,DJ,DJ,DJ,DJ,DJ,DJ
DEUTERONOMY,"""HERB""s",SPICES,OPERA AROUND THE WORLD,BUSINESS & INDUSTRY,FRENCH,U.S.A.,ROCKS & MINERALS,HISTORY,ECONOMISTS,BOOKS & AUTHORS,ABBREVIATIONS
bread,Herbert Hoover,ginger,the Metropolitan,Levi Strauss,left & right,jazz,plaster of Paris,Genghis Khan,Darwin,Custer,the Boy Scouts of America
the 10 Commandments,Don Herbert,cloves,Norway,Harley-Davidson,I have a headache,the Boston Tea Party,marble,Lisbon,happiness,Joan Rivers,rural free delivery
the mezuzah,Frank Herbert,mustard,La Scala,Hallmark,a wedding ring,the San Fernando Valley,graphite,Panama,wages,the potato famine,the knight
the 40th year,Herb Alpert,allspice,South America,Delta,I would like to buy a half dozen eggs,Connecticut,amethyst,(Abel) Tasman,The Wealth of Nations,The Spirit of St. Louis,baronet
scales & fins,Victor Herbert,cayenne,Spain,Subway,yellow,the Potomac,chalk,the Organization of African Unity,(John Maynard) Keynes,Frances Perkins,acetone
