J,J,J,J,J,J,DJ,DJ,DJ,DJ,DJ,DJ
A BY-THE-BOOK HOW TO,"COFFEE, NOW",SPIDERS & SNAKES,"CROSSWORD CLUES ""W""",YOU'VE GOT SOME BAGGAGE,JOHN LENNON,B.C.-ING YOU,BEFORE & AFTER,A VACATION FROM POP CULTURE,THE DANUBE,SENATORS,A DEEP DIVE INTO...
the Fight Club,decaf,silk,wasabi,Treasure Island,Liverpool,Armenia,Typhoid Mary Poppins,No Shoes,Vienna,,
Dr. Hannibal Lecter,cherries,a garter,a worrywart,a trunk,a green card,Sophocles,wait until the cows come Home Depot,the Go-Go's,the Black Forest,a duel,Tarzan
Lose a Guy,the French press,a brown widow (spider),the Whatchamacallit bar,a garment bag,New York (City),the Punic Wars,2 by 4/20,White Lotus,Croatia,Warren,ACE inhibitors
(Dr. Victor) Frankenstein,roasting,wolf,windward,Cheryl Strayed,Fantasy,the Han Dynasty,Caesar's Palace of Versailles,"""Holiday Road""",the Carpathians,the Civil Rights Act,breach
A Clockwork Orange,fair trade,a scarlet kingsnake,Wanderlust,a Gladstone bag,"""Give Peace A Chance""",Xerxes,Air Force Quit,The Way Way Back,Moldova,(Ted) Stevens,fenugreek
