J,J,J,J,J,J,DJ,DJ,DJ,DJ,DJ,DJ
CLASSICAL MUSIC,WHAT IN THE WIDE WORLD OF SPORTS...?,TAKE IT BACK!,VEGETABLE STEW,"THE PAST, PRESENTLY",THE MISING LETER,ON THE MAP,A WOMAN'S PLACE,MOVIE TITLES WITH NUMBERS IN THEM,PAINFUL MEMORIES,THE WRITER'S STRIKE,"AN ""H"" & ""R"" BLOCK"
"Keyboard specialist Domenico Scarlatti spent years making church music for this basilica, specifically for its Julian Choir","Making the best of a bad past situation, this ex-heavyweight champ from Brooklyn put out edibles in the shape of ears in 2022","The slogan ""Take Back Control"" is credited with helping this event get approved in a 2016 U.K. referendum","This spudly bit of the song ""Let's Call The Whole Thing Off"" means ""there's no difference, who cares?""","Defending a pardon he granted, this president told a congressional committee he wanted ""to change our national focus""",Playright,This state has 17 million acres of forests & about 44 people per square mile,Monica Seles says the locker room for the top women players here looks like it's in Buckingham Palace,"The producers of ""Tak3n"" had a very particular set of skills to get this man back for time 3 in the role of Bryan Mills","Turn off the lights, apply a hot or cold compress to your neck & have a little caffeine at signs of this possibly days-long headache",Charles Dickens went to Lancashire to observe a strike in the industry of this plant fiber & wrote an 1854 article about it,Many state laws reduce liability for defamation if a newspaper issues this statement of withdrawal in a timely way
"Unlike Vivaldi, Philip Glass left it up to the listener which time of year it was in his composition ""The American"" these","Goalie Patrick Roy said he couldn't hear what Jeremy Roenick said, due to ""my 2"" rings for winning this trophy plugging my ears","The campaign Reclaim Your Vote can tell you the deadline to do this in each state (Alabama: Oct. 21, 2024)","Slice king, long maraicher & gherkin are all varieties of this gourd vegetable","This Germanic people were separated from the Ostrogoths & in 378, not only defeated the Roman army but killed the emperor",Consience,"The U.K.'s second most populous city, it lies in an industrial area near the geographic center of England","Women ""sizes 10-40"" can shop at stores bearing this name, which includes a misspelling of founder Lena's first name on a bank form","""Se7en"" had this actor demanding, ""what's in the box?!"" & very much not liking what is in the box",Post-herpetic neuralgia is a complication of this disease caused by the same virus that gave you chickenpox,Jurgis' journey through capitalism & exploitation takes him from worker to strikebreaker in this Upton Sinclair novel,"The legal money of a nation is said to be the ""coin of the"" this"
"This type of musical mass for the dead has a Latin name; Benjamin Britten wrote a ""War"" one incorporating poetry & Latin prayers","In 1900 the U.S. beat the Brits in the first match for this international team tennis ""Cup""","Campaigns called Take Back the Tap, aiming to reduce Americans' passion for this, say it's not specially safe & bad for the planet","Last name of Albert, nicknamed ""Cubby"", who produced many James Bond films as well as ""Chitty Chitty Bang Bang""",The 15th century Church of Santa María in this city endured through the 1937 attack that inspired a classic work of art,Soverein,This country's Zambezi River border with Zambia is only a few football fields long,"On Chartres Street in this U.S. city stands the Old Ursuline Convent, spared by a 1794 fire after ferocious prayer from the nuns","In 2001 he was on film in ""Thir13en Ghosts"" as Arthur Kriticos & a year later, began an Emmy-winning life on TV as a ""Monk""",Posture training & diet changes can help relieve pain in the 2 joints that connect your lower jaw to your skull & go by this abbrev.,"Jack Kelly's nonfiction book ""The Edge of Anarchy"" is about the 1894 strike against this man's railroad car company","It's the ""tranquil"" musical term for the combination of pitches heard here"
The introduction to this Strauss waltz classic invites dancers to come to the ballroom floor,In 2022 Chloe Kim was golden--again--defending her women's halfpipe Olympic title in this sport,"In 2008 the Hindu American Foundation  launched ""Take Back""  this practice that's much more than the physical  postures of asana",The first prop this comic used was a Neighborhood Watch sign that he stole to show that the Watch wasn't very watchful,"On Nov. 4, 1964 he was exiled from Iran; 15 years later, he was running the place",Fennig (old coin),"The central town of the 100,000-square-mile area of Australia called the Red Centre is this community, named for Alice Todd","Open for 10 days until the cops came in 1916, the Brownsville Clinic in Brooklyn was the USA's first to offer guidance about this","You might say this Oscar winner became a godfather in 2002 playing a movie director who (virtually) created ""S1m0ne""","High in anthocyanins, cherries may ease pain from this arthritis often in the big toe & caused by excess uric acid","Ken Kesey's ""Sometimes a Great Notion"" concerns a timber strike in Wakonda--not in Africa but in this state, Kesey's home","I say without fear of this, an extravagant exaggeration, Butterbean is the greatest boxer of all time"
His 7th Symphony premiered in 1813 at a benefit after a battle & its second movement is seen as a funeral march,"Deferred payments in a 2000 MLB contract had this 53-year-old ""Jr."" making $3.6 million as the Reds' 4th-highest paid player in 2023","TBTN for short, this movement against sexual violence has been marching since the 1970s",This yellow-fleshed root eaten as a vegetable is called a swede by the Brits,Numerical nickname for Mao's wife & her allies arrested after Mao's death for actions during the Cultural Revolution,Lim (to draw or outline),"Lying between Italy's ""heel"" & ""toe"", the Gulf of Taranto is an inlet of this sea named for a nymph of Greek mythology",Hillary Clinton was the first student ever asked to give the commencement address at this college,"In 2022 she played Gemma, a robotics engineer who brought ""M3GAN"" to life; maybe some ""Girls"" are more fun to hang out with",Moderate aerobic exercise like swimming may help with this 12-letter chronic condition of severe muscle & soft tissue pain,"The striking miners have the sympathy of this French realist author in his 1885 novel ""Germinal""",This calm & peaceful word describes weather or ahhh... those idyllic days of youth
