J,J,J,J,J,J,DJ,DJ,DJ,DJ,DJ,DJ
PRESIDENTS & FIRST LADIES,"CULTURE, POPULARLY",ITALIAN PRODUCTS,WORDS & THEIR MEANINGS,WHAT ARE YOU AFRAID OF?,"RELAX, IT'S MATH",THE PICTURE OF SOMEONE NAMED GREY,SHARED INTERNATIONAL LAKES,NAME THAT AUTHOR,"20th CENTURY SONG, 21st CENTURY AD",I'LL REMEMBER LATE APRIL,"""PRO"" NOUNS"
"A children's library & learning center in Little Rock, Arkansas is named for this first lady","In January 2024, the copyright on the 1928 version of this character expired, so we can show him without, mmm, legal issues","A post-World War II shortage of cocoa led to a product called Giandujot, a precursor of this hazelnut spread","From the Latin for ""somewhere else"", it can be a claim that proves innocence or the person who backs up that claim","Glossophobia: This, especially in public","From Latin for ""twice"" & ""cut"", it means to divide a line or figure into 2 equal parts","This woman, who had a short reign in England, was executed in 1553, along with her husband of less than a year",Egypt & Sudan share this lake created by the building of the Aswan High Dam,"""Early in the spring of 1750... a man-child was born to Omoro and Binta Kinte""","'70s Native American band Redbone are back as ""Come & Get Your Love"" is in ads for this brand's trucks like the Silverado","Soviet victims of radiation accidents are remembered every April 26, the day of the meltdown at this site",The process of authenticating a will
"The last first lady born in the 1800s, she passed away in 1979, outliving Dwight by 10 years","Gene Autry's been gone for a while, but he was on the Billboard Hot 100 in late December 2023 with ""Here Comes"" this fellow","It takes 12 years to make the traditional kind of this 2-word ""black gold"" from northern Italy","Aspirin is an analgesic, describing its effect & from Greek for ""lack of"" this",Coulrophobia: These performers & please don't send them in,"""Like fractions"" have the same this, making it easy to add & subtract them","Joel Grey did a wonderful job as this character when ""Wicked"" premiered on Broadway in 2003",Lake Champlain is shared by the states of Vermont & New York & this province,"""Oh, how he loved that smell! And oh, how he wished he could go inside the factory and see what it was like!""","Perhaps hearing ""You're My Best Friend"" from this band's album ""A Night at the Opera"" got you to book that Carnival cruise","Centuries after Europeans named it, then with no ""I"" in ""Serra"", this country became independent April 27, 1961",An expert who uses behavioral knowledge to identify suspected criminals
"A shopaholic who enjoyed lavish clothes & redecorating the White House, by 1864 she had spent over $27,000","In ""Poor Things"", this Oscar winner becomes kind of a combination of Eliza Doolittle & Frankenstein",This car brand's name begins with the first phonetic letter of the NATO alphabet & ends with another,"From Italian, it can mean a daring desperado as well as a cheer",Chorophobia: This activity,"In a Tom Lehrer song, a movie called ""The Eternal Triangle"" stars Ingrid Bergman as this longest side of a right triangle","In 1919, Sir Edward Grey came from England to try to get the U.S. to join this new world organization, didn't work","This Russian hero named for a victory at the Neva River also won a battle on frozen lake Peipus, now shared by Russia & Estonia","""The John Galt line was moving forward. The attacks on his metal had ceased""","This lodging service founded in 2007 built an ad around Bob Dylan's ""Shelter From The Storm""","This Swiss-based superlab released the World Wide Web free to all April 30, 1993, having considered charging a user fee",An introduction to a literary work
In the 1860s his great-grandfather George Washington Baines served as president of Baylor University,"It was a letter-perfect day on Jimmy Kimmel's show when Warren G welcomed this sax man to help out on ""Regulate""","According to the ""New York Times"", a marketing blitz by Campari Group made this orangey spritz the drink of the summer in 2018",It's not trivial knowledge that trivia comes from a word meaning a spot where 3 of these meet,Samhainophobia: This holiday,"It's a constant that multiplies a variable; in physics, there's a well-known one ""of friction""","Like many of his bestsellers, 1921's ""The Mysterious Rider"" concerns cowboys & gunslingers in the Old West","Niger, Nigeria & Cameroon all share this lake with its namesake nation","""It was porkmaking by machinery, porkmaking by applied mathematics ... but this slaughtering machine ran on""","""Good Times Roll"" by this group turned up in a Capital One ad","On April 29, 1945 the 45th Infantry Division of the U.S. 7th Army arrived to liberate this concentration camp near Munich","A prominent nose, or an elephant's trunk"
"Not highly regarded by historians, he's the 19th century president seen here",Heirs get split one by one in this 2023 Netflix miniseries based on a Poe short story & starring Mary McDonnell as Madeline,The marble capitals of the rotunda at the U. of Virginia are made of this type of marble named for a town near the Apuan Alps,"It once meant a light, fast ship but has come to mean one that's old & worn-out & possibly dismantled","Porphyrophobia: This, literally, also the title of a 1983 Pulitzer Prize-winning novel",These coordinates named for a 17th c. man describe the position of points in space in relation to an x-axis & y-axis,"As prime minister, the Second Earl Grey, a leader of the liberal party called this, passed the democratizing 1832 Reform Bill","The world's highest navigable lake, it's shared by Peru & Bolivia","""'I got in a couple of hassles at the work farm, to tell the pure truth, and the court ruled that I'm a psychopath""'",Bud Light Seltzer put this KC & the Sunshine Band footwear in a commercial,This organization was founded 80 years ago on April 25 to benefit institutions including Howard & Morehouse,"From Latin for ""to beget"", it's a forefather or originator"
