J,J,J,J,J,J,DJ,DJ,DJ,DJ,DJ,DJ
THE OLD WEST,SONG LYRICS,ASTROLOGY,PLANTS & TREES,12-LETTER WORDS,AREA CODES,COUNTRIES OF THE WORLD,LITERATURE,FAMOUS NAMES,FEDERAL AGENCIES,FOOD,LEFTOVERS
"After Jan. 24, 1848, James Marshall was followed around by people hoping he would find more of this","""I'm wearing second hand hats — second hand clothes — that's why they call me"" this",Red is considered a harmonious color for people born under this sign of the ram,"Of the 900 million bulbs we import from this country each year, only about 1/3 are tulips","In 1991 Vermont marked this, its 200th anniversary of statehood","The area code for this entire state is 602, whether you're calling Apache Junction or Yuma",Both the franc & the peseta are legal tender in this small mountainous nation,"Berzelius Windrip is elected president of this country in ""It Can't Happen Here"" by Sinclair Lewis","Karl Doenitz briefly led this country in 1945, presiding over its surrender","Established in 1934, it licenses & regulates all radio & TV stations","It's the ""shell"" of a burrito",The first Winter Olympics were held at Chamonix in this country in 1924
"Records indicate between 1859 & 1872 Mexican bandits stole 145,298 of these from the King & Kenedy Ranches","""If you ever plan to motor west — travel my way, take the highway that's the best, get your kicks"" here","Appropriately, this sign is characterized by a ""goat""like ability to climb over life's obstacles","Until the 20th century, its main uses were for floats, shoe soles & bottle stoppers",Optical toy consisting of a tube with bits of colored glass reflected by mirrors,In area it's the largest state that has just 1 area code: 907,Goteborg is this country's principal seaport & shipbuilding center,"The 1904 novel ""Green Mansions"" is set in this continent's tropics",Alexander Gardner began his career shooting the Civil War for this more famous photographer,This agency not only ensures the safety of edibles & medicines but of cosmetics as well,"This brownish-black liquid is used in making pumpernickel, pumpkin pie & Boston baked beans",This word for the highest ranking bureaucrats of imperial China comes from Portuguese
It's the protuberance on a Western saddle around which a rope could be dallied or tied,"""Oh my darlin', knock three times on"" this ""if you want me; twice on the pipe if the answer is no""","Of Cancer, Pisces, or Aquarius, the one that isn't classified as a water sign",It's the most abundant natural textile fiber,"It can describe a sophisticated, worldly woman, or the magazine she reads","It's the area code for our offices at ""Jeopardy!""","This North African country's 3 main regions are Cyrenaica, Tripolitania & Fezzan","Frank R. Stockton's story ""The King's Arena"" was renamed ""The Lady or"" this",The grandfather of this mobile sculptor made the statue of Wm. Penn atop Philadelphia's city hall,"In addition to issuing patents, the U.S. Patent Office also registers these","Usually made of the Royal Ann variety, this treated fruit is the garnish in a Shirley Temple","On August 22, 1989 Rickey Henderson became the 5,000th person struck out by this pitcher"
"Though these Indians had scalped Mormons, Brigham Young said he would not attack & made peace","""I'm going to buy"" one of these ""that I can call my own""","The opal is a suggested stone for women born under this sign; you might wear 1 on each hand for ""balance""",The part of a chicory plant that is roasted with coffee beans,It's the proper medical term for high blood pressure,"""The Bronx is up but the Battery's down"" & this is the area code for both of them",This Latin American country leads the world in the production of silver,Magnolia Hawks runs off with Gaylord Ravenal in this Edna Ferber novel,This Norwegian explorer was killed trying to rescue Italian Arctic explorer Umberto Nobile,Among its functions are to control air traffic & to write & enforce air safety regulations,"When talking about crushed grains, it's hominy grits & buckwheat these","Andrew Young was our ambassador to this from 1977-79, before serving as Atlanta's mayor"
"This gunslinger born in 1853 was named after the founder of the Methodist Church, John Wesley","John Lennon wrote. ""It's like we both are falling in love again, it'll be just like"" doing this","This sign is known for directness—as direct as an arrow speeding to its mark, you might say",Ikebana is the Japanese art of this,It's a person who makes his living collecting & analyzing numerical data,"If you want to call our nation's capital, this is the area code you need to know",About 1/3 of this Mideast country's foreign trade earnings comes from sales of cut diamonds,"Like ""The Luck of Roaring Camp"", his novella ""M'liss"" is set in a mining camp",This Hawaiian swimming star was sheriff of Honolulu 1932-61,"A part of the Treasury, this agency designs & issues postage stamps & Federal Reserve notes","Small, light, shell-shaped, spongy cakes immortalized by Proust","In 1988 President Reagan gave the National Medal of Arts to this ""Humboldt's Gift"" author"
