J,J,J,J,J,J,DJ,DJ,DJ,DJ,DJ,DJ
THE CZAR,21st CENTURY HORROR NOVELS,ROLLING STONES LYRICS,DATING/APPS,THE GOLDEN GATE BRIDGE,BIRD IDIOMS,"""G"", LOOK AT THAT",AMERICAN CAVES,FACT: NONFICTION,PHYSICS & ENERGY,TV CRIMINALS,ITALIAN WORDS & PHRASES
Ivan IV (Ivan the Terrible),Alice,"""Jumpin' Jack Flash""",a slider,a suspension bridge,a night owl,groomsmen,Kentucky,Michelle Obama,the X-ray,Orange is the New Black,a piazza
Peter the Great,a haunted house,"""Sympathy For The Devil""",jalapeños,the Pacific Coast Highway,proud as a peacock,Gorgonzola,South Dakota,J. Edgar Hoover,stable,The Boys,spumante
serfs,meddling kids,"""Start Me Up""",pigs in a blanket,anchorage,a spring chicken,the guanaco,a pupfish,Ken Burns,potential (energy),The Wire,Buon Natale
Nicholas,Lovecraft,"""Time Is On My Side""",quesadillas,Marin (County),"""The Ugly Duckling""",gossamer,Carlsbad Caverns,Bob Dylan,decibels,Milo Ventimiglia,adagio
a parade ground,Pinhead,"""Beast Of Burden""",crab Rangoon,international orange,the cock of the walk,Giorgione,Wisconsin,highly effective people,a linear accelerator,Criminal Minds,don't look a gift horse in the mouth
