J,J,J,J,J,J,DJ,DJ,DJ,DJ,DJ,DJ
THE AUTO MAN EMPIRE,SONGS IN MUSICALS,OLD NAMES FOR MEDICAL CONDITIONS,DESCRIBING THE ARTWORK,DOGS & CATS LIVING TOGETHER,LETTER & WORD,THE OTTOMAN EMPIRE,WHOSE LINE IS IT ANYWAY?,CITY MUSEUMS,SAY CHEESE!,LIFE SCIENCE,FROM THE ITALIAN
"In 1914 this automaker raised the minimum wage for his employees to $5 a day, more than twice the going rate","""Memory"" & ""Mr. Mistoffelees""",This older name for tuberculosis referred to the disease's wasting away of the body,"In an 1851 work this general stands in a small boat on the Delaware, a U.S. flag nearby",Toy dogs like the Chihuahua can be trained to use these; experts say fill your dog's with the non-clumping stuff,"June 6, 1944","In 1566 this ""Magnificent"" sultan was succeeded by his not-so-magnificent son Selim II, ""the Sot""","In ""Gentlemen Prefer Blondes"", she inquires, ""Is this the way to Europe, France?""",The National Gallery of Art (in the United States),"This cheese usually aged & grated is named for the ""Eternal City""","Botanically, it's the part of the flowering plant that holds the seeds, so it includes acorns","Italian for ""unknown"", it's how you travel when you don't want to be recognized"
He had a good year in 1928; construction began on the New York City Art Deco building named for him & he acquired Dodge,"""Tradition"" & ""Matchmaker, Matchmaker""","This infectious illness has long been known as the ""kissing disease""","God, aided by cherubim, reaches out to this bored-looking guy; oh yeah, it's on a ceiling","Dogs & cats shouldn't share food, as cats are obligate these & their chow is too high in protein to be good for dogs","In a 1954 experiment, U.S. Air Force Dr. John Stapp accelerated to 632 miles per hours in five seconds, surviving 46 of these units",In 1571 the Holy League defeated Ottoman naval forces in the Gulf of Patras off the coast of Lepanto in this current nation,"1939: ""That's what's wrong with you. You should be kissed, and often and by someone who knows how""",The Exploratorium,Edam is made in a ball; this other Dutch cheese is made in wheels with a waxed red or yellow rind,"In HIV these genetic changes that alter the organism happen so fast, a single AIDS drug is unworkable","Tossed at New Year's, it has a name meaning ""sweetmeats"", the little candies tossed during carnival"
Charles & Henry were the first names of this pair of Englishmen who produced the Silver Ghost in 1907,"""It's Raining On Prom Night"" &""Look At Me, I'm Sandra Dee""","In ""Julius Caesar"", Shakespeare mentions ""falling sickness"", this disorder characterized by seizures","In this work mom is seated, facing left--or is it right? Anyway, she's clad in black with a white lace cap","Experts say this breed that originated in Newfoundland is good with cats--& heck, everything else",The most common human blood type (make sure to include whether it's positive or negative),The Ottoman Empire ended in 1922 when this man led a movement that established the Republic of Turkey,"At the end of ""Little Caesar"", this actor cries, ""Mother of Mercy. Is this the end of Rico?""",Carnegie Museum of Natural History,Herman & Lily know that this oft-imitated cheese shares its name with the Alsace valley where it originated,"In the Batesian type of this, aka imitation, an organism evolves to look like a more noxious one so it's left alone","These quick appearances by guest stars in films can carve out a little comic ""relief"""
"This early 1900s racer who gave his name to a major GM division was born in La Chaux-de-Fonds, Switzerland","""Johnny's Mambo"" &""(I've Had) The Time Of My Life""","An old name for influenza wasn't grab or clutch but this, from French for ""seize""",We're not sure if you'd call that teal or azure the young man with a feathered cap is wearing in this 1770 work,"The AKC says these herding dogs that come in ""rough"" & ""smooth"" types love children & ""that love can extend to cats""",A cheap film shown in addition to the main feature,"In the early 14th century the Ottomans moved their capital to Bursa, which is in this Asian part of modern-day Turkey","""A boy's best friend is his mother""",The Edgar Allan Poe House & Museum,"Danbo, a cheese  originally from this country, is also known as  King Christian IX when made with caraway seeds",Transporting this protein is the main job of your body's erythrocytes,"Ben Jonson's 1598 comedy ""Every Man in His Humour"" uses this Italian term for a brothel"
"In 1932, this auto racer began using the squadron badge of a World War I flying ace, a prancing horse","""The Music And The Mirror"" & ""One""","Pens down, scrivener's palsy is an old term for this, also known as graphospasm","Children frolic among wild beasts as a confused lion looks out at us--it really is ""The Peaceable"" this",The kitten's investigating the tail of a pup of this terrier breed named for an English cleric,"Violinist August Wilhelmj's arrangement of the 2nd movement of Bach's ""Suite No. 3 in D major"" is known as ""Air On"" this","With a name meaning ""new troops"", these elite infantry soldiers originally consisted of slaves & prisoners of war","In ""My Favorite Year"" he wails, ""I'm not an actor, I'm a movie star!""","The Museum of Pop Culture in this city has been called ""Blobitecture""",This Swiss cheese that dates back to the 12th century is named for a valley in the Canton of Fribourg,"This 5-letter word for a virus that infects a bacterial cell is sometimes prefixed by ""bacterio""","Somewhere along the line this instrument's name lost its big finish of ""forte"""
