J,J,J,J,J,J,DJ,DJ,DJ,DJ,DJ,DJ
FROM THE NEWSPAPERS,INVESTING & BUSINESS TERMS,ONE-WORD BEATLES SONG TITLES,SOUP'S ON,IDIOMS & EXPRESSIONS,LITERARY TITLE ADJECTIVES,PLAIN GEOGRAPHY,PROSE & CONGRESS,UNMANNED SPACE EXPLORATION,THE KNIGHTLY NEWS,WHO'S THE BIOPIC SUBJECT?,"STARTS WITH ""P"""
Constantinople,net worth,birthday,green,in plain sight,Wide,Sharon,the New York Knicks,airbags,the Holy Grail,Neil Armstrong,a parka
Benazir Bhutto,a dividend,the taxman,Manhattan clam chowder,a rule of thumb,Rich,the Serengeti,Amy Klobuchar,Magellan,the Golden Knights,Fossey,paleo
(Medgar) Evers,a key performance indicator,Michelle,leek,a vibe check,Dangerous,a nuclear silo (a missile silo),Profiles in Courage,a comet,Sir Gawain and the Green Knight,Kyle,peekaboo
Weimar,stop-loss,Revolution,pho,"no pains, no gains",Normal,Salisbury,Bernie Sanders,Charon,Burberry,(Fanny) Brice,a palisade
Sacco & Vanzetti,volatility index,blackbird,pepper pot soup,(coming) down the pike,Bald,the Olmecs,Lewis,Vesta,the Knights Templar,Thomas More,peregrination
