J,J,J,J,J,J,DJ,DJ,DJ,DJ,DJ,DJ
THE REALLY OLD COLLEGE TRY,JUST KIDDING,A WOMAN OF THE WORLD,THE NAME OF THE GAME,ALWAYS SAY NEVER,STUPID PROVERBS,A RIVER RUNS TO IT,"""BABY"" MOVIES",THE HISTORY CHANNEL,PEOPLE WITH MUPPET NAMES,"NO, I DON'T NEED A DOCTOR",SMART ANSWERS
"In 1638 the first class was in at this university, which consisted of 1 master in a single frame house & a college ""yahd""","Mitch Hedberg: ""I like"" this grain. It ""is great when you're hungry & you want 2,000 of something""","She was in Kenya when she learned she had become queen on February 6, 1952",Also a fireplace implement,"Created by Bill Watterson, this comic strip kid says of class bully Moe, ""Never argue with a 6-year-old who shaves""","""Fight"" this ""with fire""",The Yakima: To this larger Pacific Northwest river,Ruth Gordon played Mia Farrow's next-door neighbor in this scarefest,We know the conqueror seen here by this name,"This grouchy librettist won a 1950 Pulitzer for his work on ""South Pacific""","No, it's not a metallic sensory organ but a phrase meaning I'm insensitive to music & can't carry a tune","Both Cervantes & Ben Franklin wrote, ""A word to"" these people ""is enough"""
"This university was formed around 1209 by people fleeing ""town & gown"" tensions in Oxford","This ""Price is Right"" host: ""Hate your job? There's a support group for that--it's called everybody. They meet at a bar""","An Asian prime minister for 15 years, she was called ""Indu"" for short",A war vessel of the most heavily armed class,"Line that precedes ""they simply fade away"" in a British army song","An American proverb says, ""Money begets"" this",The Platte: This river that runs to another river,Hilary Swank stars as Maggie Fitzgerald,"After being banished from Iceland, this colorful guy established a colony in Greenland around 985",22nd & 24th POTUS,"It's a term for a short-tempered person, not a feverish condition felt above the eyebrows","It's what the ""I"" stands for in the CIA (the one headed by William J. Burns)"
Around 1257 the apparently unbashful theologian Robert de Sorbon founded the Sorbonne at the Univ. of this,"A. Whitney Brown: ""I'm a"" this ""not because I love animals, but because I hate plants""","In 1767 this ""Great"" empress called a commission on legal reform",A hand weapon made of leather-covered metal,"""He that fights and runs away may"" these 5 words ""but he that is in battle slain will never rise to fight again""","You'll find things are in order with ""a place for"" this ""and everything in its place""","The Indus River flows 1,900 miles before emptying into this sea that shares its name with an adjacent peninsula",Cary Grant & Katharine Hepburn grapple with a pet leopard,"Irish teenager Annie Moore made history here January 1, 1892","The first player in the National League to be MVP two years in a row, he's known as Mr. Cub","No, this is not a symptom of hepatitis but a deli appetizer smeared on rye bread; what am I...?","In a Jay McInerney book title, these 2 words precede ""Big City"""
"Franz Joseph inaugurated the new main building of the university of this capital, the oldest university in the German-speaking world","The irreplaceable Robin Williams said, ""To a 3-year-old"" this guy ""is a 6-foot rat!""","In 1993, True Path Party leader Tansu Ciller became the first female prime minister of this large Muslim country",To overwhelm  with wonder,"In his ""Ballad of East and West"", this Brit wrote, ""East is east, and west is west, and never the twain shall meet""","""Nothing"" does this ""like success""","The Hudson: ""Upper"" this bay","A wheelman for Atlanta bank robbers, Ansel Elgort plays a tinnitus-afflicted hero in this Edgar Wright flick","Around the 1850s archaeologists unearthed the great library of Ashurbanipal in Nineveh, capital of this ancient empire",This patron saint of Mediterranean sailors  lent his name to a phenomenon seen during storms,"No, my scapula doesn't have osteomalacia--I'm talking about a road sign meaning the highway's edge is not firm",A gem with this cut resembles two truncated pyramids set base to base
"I come to wive it wealthily at the university of this, founded in 1222 by ex-University of Bologna students","On ""Between Two Ferns"", this actor asked Ben Stiller, ""Do you wish... you had ever followed your parents into comedy?""","An exotic Dutch dancer & courtesan, she was executed by the French in 1917 on charges of spying for the Germans",The art of negotiation between nations,"Shelley said of this, ""Hail to thee, blithe spirit! Bird thou never wert""; Wordsworth said they ""soar, but never roam""","We're due for this proverb: ""Give credit where credit is"" this",The Vistula:This sea,Ben Affleck directed this tale about the kidnapping of a little girl,"This 6th century Byzantine emperor, lawgiver & Christian expelled pagan teachers from the Athens Academy",Nickname of I. Lewis Libby who grew up to be Vice President Cheney's powerful chief of staff,I don't personally have a gnarled extremity--this feature is on my old-fashioned bathtub,"This adjective that means ""cunning"" probably comes from the name of a ""tamed"" insectivore"
