J,J,J,J,J,J,DJ,DJ,DJ,DJ,DJ,DJ
IN THE FOOTSTEPS OF HISTORY,TENNIS-Y WILLIAMS,LITERATURE,STATE OF THE COLLEGE,IT'S ALL RELATIVE,A PROVERBIAL MESS,BROWNIAN NOTIONS,SCENES FROM AN ITALIAN RESTAURANT,THE SEA'S BOUNTY,"A MATTER OF ""LIFE"" OR ""DEATH""",HELL,HIGH WATER
Trace Jesus' steps in this city as he walked down the Via Dolorosa toward Golgotha,"Venus & Serena grew up in this huge city's suburb of Compton, better known for rappers than groundstrokers",Homer begins this epic poem by telling us it's about the anger of Achilles,"Weber State is near a ""Great"" lake in this state",It's a pendular timepiece with a case as tall as or taller than a person,Son father like like,"He soulfully sang it's a ""man's world, but it wouldn't be nothing, nothing without a woman or a girl""","Before she was a pretty woman, this actress mopped the floor of the title joint in ""Mystic Pizza""",They're seen here accompanying shrimp & lacking their distinctive shells,"Bread, as the mainstay of the human diet, is known as this","In Norse mythology, Hel, daughter of this troublesome god, ruled Niflheim, where sinners were tormented","After floods in 1966, UNESCO made efforts to save this Italian city & its treasures, like the Biblioteca Marciana"
A tour of his infamous trail of murder starts at the Aldgate East tube station,Venus took the 2000 & 2001 singles titles at this British Grand Slam event,"Louis de Pointe du Lac, not Lestat, is the title undead being queried in this novel","It's the state of Wayne State University, attended by Jack White, Lily Tomlin & Steven Dorfman","In 1917 he founded Boys Town in Omaha, open to boys of all races & religions",Words louder than actions speak,"Referring to the nickname ""Governor Moonbeam"", he says, ""I've earned that moniker""","Later movies in the ""Rocky"" oeuvre include scenes in the restaurant Mr. Balboa opened & named for her","In a Japanese restaurant, kani is this crustacean & kani-kamaboko is fake this crustacean",A source of rescue in a crisis; phone a friend is one example,Delacroix depicted this Roman poet guiding Dante across the River Styx,"The Zuiderzee Flood of 1287 killed 50,000 but also connected this then-village to the sea, & the rest is Dutch history"
Starting at the Boston Common & ending at the Bunker Hill Monument is this 2-word path,"In 2001 the Williams sisters got ""animated"" on the court in the ""Tennis the Menace"" episode of this Fox series","For telling the truth about a town's contaminated water supply in an Ibsen play, Dr. Thomas Stockmann becomes this title foe",Muncie in this state is home to Ball State University,"Seen riding a flying gander, this character is usually traced back to a 1697 book by Charles Perrault",From a blood stone you get can't,"He said he knew ""slave-holders"" would not give up their slaves ""till they felt a big stick about their heads""",Danny Aiello awkwardly proposes to Cher in an Italian restaurant in this 1987 film,"Boquerones, which are these, are a favorite on tapas in Spain; they've fallen out of favor on American pizzas",Alliterative term used to publicize a circus performer who puts himself at great risk,Milton used this word for the capital of Hell; now it means wild confusion,"In 1887, 1931 & 1938 northern China was devastated by flooding of the Huang He, this colorful river"
"Hike in the footsteps of settlers & Native Americans on the Natchez Trace, starting in Natchez in this state","In 2003 Serena completed a ""Serena Slam"", beating Venus 7-6, 3-6, 6-4 at this event in Melbourne","""A drowsy numbness pains my sense, as though of hemlock I had drunk"" is a line from his ""Ode to a Nightingale""",Tufts is a centerpiece of Medford in this state,"Covered in hair from head to foot, this member of ""The Addams Family"" spoke in a language all his own",Bright on the always side look,"Before he became U.K. prime minister, he said economic & ""environmental objectives now... reinforce each other""",Mookie throws a trash can through the window of Sal's Famous Pizzeria in Brooklyn in this 1989 film,The Dover type of this fish isn't confined to British waters; it's found in the Mediterranean,"Though they sound like they sit on the beach, they're the senior British army regiment & first saw action in the 1600s","This French existentialist's play ""No Exit"" posits that hell is other people",A dam collapse in this state led to the deadly 1889 Johnstown Flood
Retracing this 1930s journey will take you thousands of miles from Ruijin to Yan'an,"The way this dad of Venus & Serena managed their careers brought some criticism, but turned out pretty well","In this 1948 Shirley Jackson short story, a village selects a sacrificial stoning victim to ensure a good harvest",The Campbell Fighting Camels are from near the Cape Fear River in this state,This first novel by Theodore Dreiser tells of a young woman's rise to become a successful Broadway actress,Never better than late,"She ran Vanity Fair & the Daily Beast but said, ""I didn't see myself as an editor. I wanted to be a playwright""","In the final scene of this film, Secondo makes a frittata for Brother Primo in the Paradise restaurant","This shellfish of the family Mytilidae needs its beard removed, a little steaming & yum",One of the Arabian Nights begins with a proud king who's not so proud when this heavenly being appears to him,In Greek mythology the gods consigned their enemies to this region under Hades,2010-11 floods in Australia were exacerbated by this Pacific Ocean weather phenomenon with a feminine name
