J,J,J,J,J,J,DJ,DJ,DJ,DJ,DJ,DJ
THE LAST SUPPER,QUOTABLE CINEMA,THE MAORI,ANATOMY,FABRICS,"THE ""LONG"" & ""SHORT"" OF IT","LEONARDO DA VINCI, BUSY GUY",BROADWAY MUSICALS BY CHARACTERS,"""A""UTHORS",MICROSCOPY,STREET SMARTS,BAD ENGLISH
the Passover,The Wizard of Oz,New Zealand,the dermis,denim,the long jump,a tank,Grease,(Isaac) Asimov,a flea,Tesla,tense
the Holy Grail,Black Panther,tattoos,the iris,sharkskin,short stories (short fiction),sight,Hamilton,Aesop,a sperm,Wall Street,the apostrophe
Peter,Network,Maui,the elbow,corduroy,shortbread,Deluge,Fiddler on the Roof,Isabel Allende,pollen,Madrid,the subject
Judas,When Harry Met Sally...,a volcano,the Achilles tendon,flannel,a shortstop,the human body,The Book of Mormon,Douglas Adams,a bee,Coronation Street,flaunt
Thursday,In the Heat of the Night,Whale Rider,the rotator cuff,damask,Long Beach,an ornithopter,Dreamgirls,(Chinua) Achebe,their spores,Friedrichstrasse,a fragment
