J,J,J,J,J,J,DJ,DJ,DJ,DJ,DJ,DJ
4TH OF JULY,MOVIES BY THE NUMBERS,IN THE OCEANS,COLLEGES,BEER,RHYMING PAIRS,THE MIDDLE AGES,ANATOMY,QUOTES,VIRGINIA,THEATER,POTPOURRI
the Erie Canal,The Three Musketeers,squid,raccoon fur,Guinness,Hell's bells,Charlemagne,the windpipe,"""you'll meet them again on your way down""",Patrick Henry,Rome,wolves
Chicago,Seven Days in May,plankton,Hamburger University,Lowenbrau,a fat cat,the Children's Crusade,the brain,Charles Darwin,Jamestown,in the limelight,who
the U.S. Capitol building,Sergeants 3,sunken treasure,Wisconsin,Heineken,the Space Race,Archbishop of Canterbury,the epiglottis,"""Twinkle, twinkle, little star""",NASA,Ethel Merman,Westminster
Jack Dempsey,North Dallas 40,Oceanquest,"(2 of) Duke, the University of North Carolina & North Carolina State",Czechoslovakia,Chilly Willy,the Hapsburgs,fat,Joe Louis,Bath,P.T. Barnum,Greek
,The Four Horsemen of the Apocalypse,the Mariana Trench,Rutgers,,the jet set,Harold,the endocrine system,change,"Reston, Virginia",curtains,iambic pentameter
