J,J,J,J,J,J,DJ,DJ,DJ,DJ,DJ,DJ
THE CONSTITUTION,GOLF,GARDENING,MYTHOLOGY,MAMMALS,POTPOURRI,RULING FAMILIES,20th CENTURY QUOTES,OPERA,FAMOUS PHILOSOPHERS,LAKES & RIVERS,MOVIES IN OTHER WORDS
slavery,a tee,a rose,Poseidon,a polar bear,Connecticut,Duvalier,15 minutes,Carmen,Socrates,Switzerland,Batman Forever
"Washington, D.C.",the caddie,a compost,Cerberus,a cheetah,nicotine,Dante,the answers,Faust,(René) Descartes,the Ganges,Doctor Zhivago
the Chief Justice of the Supreme Court,the green,topiary,Apollo,a coyote,origami,Romanov,Lake Wobegon,The Barber of Seville,Jean-Paul Sartre,Victoria,The Muppets Take Manhattan
Rhode Island,a handicap,a squash,Janus,the warthog,The New York Times,Bourbon,Tom Wolfe,Salome,Thoreau,the Danube,Guess Who's Coming to Dinner
George Washington,to address the ball,sponges,Icarus,a horse,fauvism,the Sforzas,Gertrude Stein,La Traviata,Immanuel Kant,Titicaca,Who's Afraid of Virginia Woolf?
