J,J,J,J,J,J,DJ,DJ,DJ,DJ,DJ,DJ
"""A"" IN HISTORY",PRO FOOTBALL TEAMS,FASHION,AMERICANA,ROOMS,"NUMBER, PLEASE",BOOKS OF THE BIBLE,NUTRITION,PLAYS,WORLD GEOGRAPHY,POLITICIANS,MARK TWAIN QUOTES
The people of this Greek city were such fans of Phocion that they elected him general 45 times,Quarterback Joe Montana holds this team's single-season record for touchdown passes with 31,"In the 1950s women wore tight-fitting pants inspired by the style of these Spaniards, & that's no bull",This domed building in Salt Lake City's Temple Square is world-famous for its choir,A room in a hospital holding several patients; it may be a maternity one,It's the first point score in tennis,"The name of this second book is from the Greek for ""exit"" or ""departure""",Night blindness can be caused by a deficiency of this vitamin,"Part of Arthur Schnitzler's play ""La Ronde"" is set near the amusement park in this Austrian city",Currents in this ocean include the Brazil Current & the Labrador Current,"Among this former NYC mayor's books are ""His Eminence and Hizzoner"" & ""All the Best","Character who said, ""You feel mighty free and easy and comfortable on a raft"""
"Once a stronghold of the Barbary pirates, it's now Algeria's capital",This team plays its home games at Mile High Stadium,"Thong, T-Strap & Dr. Scholl's exercise are 3 types of these",Money Magazine's 1992 survey of the best places to live in America ranked this state's Sioux Falls No. 1,"It's a small room or closet off the kitchen in which food, linens & tableware are stored","Oscar Wilde wrote, ""In married life"" this ""is company and two none""","If you're patient, you can probably figure out this book has the shortest name",Fortified milk is the richest dietary source of this vitamin that's also formed when sun hits the skin,"Shaw heroine who says, ""I shall be remembered when men will have forgotten where Rouen stood""",The Palace of Justice in Paris stands on this island in the Seine River,In 1971 this Kansas senator was chosen Republican national chairman,"This ""consists of whatever a body is obliged to do...play consists of whatever a body is not obliged to do"""
"She dominated her husband, Nicholas II, as Rasputin dominated her","This team's corporate headquarters are at Halas Hall in Lake Forest, Illinois","The coat style of this garment often has buttons from neckline to hemline, like a coat",You'll find the Empire State Plaza in this capital city,"This French term for a bedroom came from a word meaning ""to sulk""","This Gerard Depardieu movie is subtitled ""Conquest of Paradise""","In this final New Testament book, Satan is bound for a thousand years",Vitamin K is essential for formation of the substances that make blood do this,"""Suddenly Last Summer"" opens in Sebastian's garden in the Garden District of this U.S. city",Columbus discovered these islands in 1493 & named them for an attribute of St. Ursula,In 1968 this third-party candidate for president garnered almost 10 million votes,"""There are two times in a man's life when he should not speculate: when he can't afford it, and"" this"
"This emperor's mother, Atia, was Julius Caesar's niece",This Florida team has a pirate on its helmets,This item of men's apparel was apparently named for its resemblance to a weapon called the Bola,The Eisenhower Theater is part of this famed performing arts complex,"From the Greek for ""hidden"", it's an underground vault used as a burial place","To be ""at"" these 2 numbers is to be in a state of confusion",She marries Boaz in chapter 4 of the book named for her,Excessive intake of this element causes fluid retention & may contribute to high blood pressure,"Part 3 of this playwright's ""Torch Song Trilogy"" is titled ""Widows and Children First""","This ""saintly"" Swiss Alpine resort has been known for its mineral springs since Roman times",Since 1965 this Speaker of the House has represented Washington State's 5th District in the House,"""When in doubt tell"" this"
Pierre L'Enfant was reburied here in 1909,Until 1989 Tom Landry was the only coach this team ever had,A mantilla is often worn over a fancy type of this grooming tool,In 1930 he claimed he'd like to be known as a former president who tried to mind his own business,"From an Old French word for ""watchtower"", it's an attic in which a poor author might live",A standard distance vision test is given this many feet from the eye chart,This book immediately following the Gospels deals mainly with the work of St. Peter & St. Paul,Minerals such as copper & zinc that are needed only in minute amounts are called these,"The only 2 characters onstage at the end of ""Who's Afraid of Virginia Woolf?""",Africa's northernmost mainland point is Ras Ben Sekka in this small nation,"In November 1988 this Maine senator was elected Senate majority leader, succeeding Robert Byrd","""There ain't no surer way to find out whether you like people or hate them, than to"" do this ""with them"""
