J,J,J,J,J,J,DJ,DJ,DJ,DJ,DJ,DJ
THE SHIP OF STATE,WEIRD AL PARODIES,THAT'S A VEGAS CASINO,CHEMICAL FORMULAS,BACK TO SCHOOL,"WORDS THAT END WITH ""E""",COW COUNTRY,FACTS ABOUT THE BEST PICTURE WINNER,THE VIKINGS,POEMS ABOUT POETRY,FURNITURE,COMPLETE THE OXYMORON
"Designated SSN-780, the current USS Missouri isn't a battleship but a nuclear-powered one of these","With permission from this performer, Weird Al parodied her songs in ""Polka Face"" & ""Perform This Way""","It's a deceptive image of a distant object; in this case, both are in the desert","HCl is this, & don't spill any on yourself","English: his ""Unfinished Tales"", a collection of more Middle-earth material, was published 7 years after his death","It's zero in tennis, the last name of a Beach Boy & all you need","With California & this as the top 2 states, the U.S. leads all other countries in producing cow's milk",James Earl Jones' father plays a mentor to Robert Redford's con artist character in this film,"A recent paper posits the herb henbane as the probable source of this legendary Viking ""rage"" during battle",This poem about 600 men / Righteously stirred the denizens / A scene from a war / In 1854 / Is anyone up for some Tennyson?,"With bookshelves, drawers & a writing surface, an escritoire or a secretary is one of these","To summarize a complicated case, the attorney submitted a lengthy..."
2 schooners called the Oregon Fir & the Oregon this carried lumber from the U.S. to Australia in the 1920s,"Parodying a hit by this singer, ""Weird Al"" had his own ""Party In The CIA""","Lesser in name only, millions of these pink wading birds gather to breed on large lakes in East Africa","It's sweet, it's simple,it's C6H12O6","Econ: GDP, this, is the market value of all goods made within a nation's boundaries during a given period","The phrase ""stay in your"" this is bad advice if you're being told not to try new things but good advice if you're driving","With more than 300 million including water buffalo, this nation leads the world in cattle & many there hold them sacred","This actress gave the nickname ""Vanguard"" to her character Fern's means of conveyance in ""Nomadland""","Many Vikings wore pendants made in the form of Mjolnir, this symbol of Thor, to protect them from danger","If you really think about it / It isn't so ridiculous / Knowing these are the first 5 words / In ""A Visit from St. Nicholas""",This name was once used for a divan introduced to Europe from Turkey; today it's a low footstool,Only 52 degrees today in Tallahassee? That's a low...
The Pearl Harbor Memorial to this ship reminds visitors it was the scene of great loss & asks them to dress appropriately,Encyclopedias & a case of Turtle Wax were among the prizes Al didn't win in this song & video that's near & dear to our hearts,"You'll find ""fifteen men on the dead man's chest--yo-ho-ho, & a bottle of rum!"" at the start of this novel",C2H5OH is this solvent that also gets added to gasoline,Social studies: In 1984 this Baptist minister established the National Rainbow Coalition,The United Nation's IPCC stands for the Intergovernmental Panel on this phrase,Criollo cattle include Texas longhorns & a breed named for this South American country of champion beef eaters,"Raymond A. Mendez is credited as ""moth wrangler & stylist"" for this 1991 film","The need for wood in Greenland prompted visits to Markland, which today is this mainland partner of Newfoundland",Youth poet laureate of L.A. in 2014 / Already quite the sensation / But she made her name / & rocketed to fame at the '21 inauguration,A little bird gave us this term for the space-saving furniture seen here,"Those diamonds are stolen! Or, in criminal slang, that's some hot..."
In the 1860s a paddle-wheeler named this plied the waters of the same-named river around Fort Yuma,"In ""My Bologna"" Al rhymes ""I'm the city's biggest bologna buyer"" with ""filling up my basket with"" this brand","Lyrics in this song include ""these vagabond shoes are longing to stray"" & ""these little town blues are melting away""","To get the formula for ammonia, put this letter before H3",History: This one of the 7 Ancient Wonders was said to be laid out on several brick terraces & 75 feet above the ground,This type of corporal is the third enlisted rank in the United States Marine Corps,There are both red & black varieties of this breed developed in Scotland,"A 1935 article highlights Gable's negging of Colbert in this film: ""Peter... tells her she's... spoiled & selfish""","Under the terms of a 911 treaty, Norse leader Rollo received this region at the mouth of the Seine River","This Whitman sampler / Was full of introspection / With ""The Wound-Dresser"" & ""Full of Life Now"" / It's a heck of a collection","This chair, a molded plywood seat & back connected by stainless steel tubing, is named for its designer",Lemonheads are a sour...
"In 1862, the captured & rebuilt USS Merrimack was relaunched as the CSS this state","This favorite mentions ""a malpractice suit"" & ""cuttin' for the very first time""",A granite shrine of Alexander the Great is in the temple of this capital of Al-Uqsur in Upper Egypt,"Also known as quicklime, CaO is this",French: I hope you remember that oublier means this; don't do it now!,An early appearance of this 2-word term describing a macho perspective was in a 1975 essay about film by Laura Mulvey,Cattle breeds from this Horn of Africa country include the Ogaden Zebu & the Nilotic Sanga,"Doug Jones said the latex rubber suit he wore in this film acted ""as a sponge""",Viking shipbuilders greatly improved the seaworthiness of their vessels by adding a wood this to form the backbone,"In 1816 he wrote ""Mont Blanc"" / & there'd be other gems / But you try rhyming ""Ozymandias"" / Do I look like Eminem?!",Seen here is a set from this Scottish-born furniture maker who was a leading exponent of the neoclassical style,Yom Kippur seemed to last forever; it was a slow...
