J,J,J,J,J,J,DJ,DJ,DJ,DJ,DJ,DJ,TJ,TJ,TJ,TJ,TJ,TJ
BOOKS IN THE SERIES,SPORTS TEAM HOMOPHONES,AUTO BIOGRAPHIES,"ONE BELLY BUTTON, TWO NIPPLES",ELEMENTARY POP CULTURE,OATHS,AFRICAN HISTORY,"DIFFERENT SONGS, SAME TITLES",GEOGRAPHY & A LITTLE MATH,"URANUS, SHMURANUS",MAINE ATTRACTIONS,"""LADY""S FIRST",KNOW YOUR -OLOGIES,TINY DESK CONCERTS,PERSONAL FINANCE,SOJOURNER TRUTH,SCIENTISTS,"CELEBRITY JEOPARDY AIN'T THE ONLY ""CJ"""
Twilight,the Suns/sons,the Pope,lung,"""Iron Man""",King Charles (III) (the former Prince Charles),mosques,"""Hello""",Prussia,Saturn,moose,the ladybug,cometology,Bono,Social Security,New York,rocket science,Cracker Jacks
Goosebumps,the Phillies/fillies,the Batmobile,scapula (your shoulder blades),Krypton,so help me God,The Woman King,"""Good Vibrations""",Indianapolis,Brooklyn,Stephen King,Lady and the Tramp,radiology,NPR,collateral,Dutch,environmental protection,Colin Jost
The Chronicles of Narnia,the Bears/bares,an ambulance,ulna,Silicon Valley,the Olympics,Portugal,"""The Power Of Love""",Nigeria,the hand,the maple,Lady Gaga,Technology,Harry Styles,your FICO score (credit score),sheep,Queen,the Crown Jewels
A Song of Ice and Fire,the Whalers/Wailers,Oscar Mayer,alimentary canal (your digestive system),copper,the Hippocratic oath (for doctors),Morocco,"""Surrender""",Arkansas,lockjaw,the Underground Railroad,ladyfingers,audiology,Alicia Keys,home equity,1826,Alessandro Volta,Caitlyn Jenner
His Dark Materials,the links/Lynx,the Beast,epiglottis,arsenic,the Knights of the Round Table,Liberia,"""Photograph""",Assyria,the 17th century,Acadia National Park,the Lady of the Lake,ethnomusicology,Shaggy,a Roth IRA,Woman,the Department of Agriculture,the court jester
