J,J,J,J,J,J,DJ,DJ,DJ,DJ,DJ,DJ
PRODUCE,DISNEY PARK SONGS,WATER UNDER THE BRIDGE,"BOOK 'EM, DAN-O","ON THE ""ROAD"" AGAIN",BETTER ASK FOR DIRECTIONS,PRODUCE,ALSO ON THE MONOPOLY BOARD,FILL IN THE BLANK CANVAS,SHE BLINDED ME WITH SCIENCE,WASN'T THAT AN '80s THING?,"SEE ""NN"""
"Big on vitamins A & C, this leafy vegetable also has a lot of fiber & acts as a mild laxative; look out, sailor man!","""Yo ho, yo ho...""",Under the Brooklyn Bridge,"In 1977, he wrote ""The Camera Never Blinks: Adventures of a TV Journalist""",In 1804 a steam carriage was first put onto one of these; it could haul 70 men & 10 tons of iron for 10 miles,Tropical cyclones in the southern hemisphere rotate in this timely direction,"Not only did he produce ""Citizen Kane"", he co-wrote, starred in & directed the film, too--talk about a best boy",Alliterative slang for crying,"An iconic 1930 image: ""____ Gothic""","Alice Ball was 23 & a college instructor in Hawaii in 1915 when she developed the first successful treatment for this, also known as Hansen's disease",A man... a woman in distress... ladder climbing... a giant ape... this video game that debuted in 1981 had it all!,We hope your dog doesn't suffer ennui when boarded in one of these establishments
"In 2008 a pair of Brits were out of their gourd, growing a 1,457-lb. one of these; smashing!","""It's a world of laughter, a world of tears...""",Beneath the Bay Bridge in Maryland: This bay,"From 1704 to 1713 he produced his own periodical, ""The Review""; ""Robinson Crusoe"" washed ashore in 1719",Swift American seen here,Direction that also means to swallow liquid hastily,"In addition to exec producing ""Michael Clayton"", he got an Oscar nomination for Best Lead Actor",Morgan Freeman's first regular TV gig,"From 1912, more mechanical than nude: ""Nude Descending a ____, No. 2""","Nobel laureate Gertrude Elion helped develop drugs to treat herpes, gout & this, cancer of the bone marrow",The Wayfarer style of this brand of sunglasses was an '80s fave,Get thee to this synonym for a convent
Dr. Thomas Welch is credited with making the first unfermented juice from this fruit,"""Grim, grinning ghosts come out to socialize...""",Under the Petofi Bridge in Budapest: This river,"""Standing Firm"" & ""Worth Fighting For"" are two books by this ex-vice president","In this hit Lil Nas X mentions his ""cowboy hat from Gucci""","Title direction for Arthur Sullivan's ""Christian Soldiers""","This mega producer & creator of ""Scandal"" declared, ""You can waste your lives drawing lines or you can live your life crossing them""","In baseball, this ""punitive"" measure began in 1997, & for the Yankees it was over $4.4 million","A group portrait by Rembrandt:  ""The ____ ____ (The Company of Captain Frans Banning Cocq)""",Rosalind Franklin's X-ray photograph of this helped prove it to be a double-helix polymer,"""Say You, Say Me"" is on his album ""Dancing On The Ceiling""",Manually sifting for gold in a river
"When life gives you the Meyer type of this tree, expect plenty of fruit year-round","""A Heffalump or Woozle is very confusel...""",Beneath the Rialto Bridge in Venice: This busy waterway,"When he made the 2005 ""Time"" 100 list, his book was described as ""the novel that ate the world""",Twin brothers Leigh & Leslie Keno are famous as appraisers on this PBS program,"New York's single-word motto excelsior means ""ever"" this direction","As a producer, he was smart enough to hire himself to direct ""A Beautiful Mind""; imagine that!",The president lives on it,"Picasso cubed it: ""Les Demoiselles d'____""","Dorothy Hodgkin's Nobel Prize in Chemistry was for her work on this vitamin, whose deficiency causes pernicious anemia","He was elected governor of Massachusetts in 1982 & 1986 & then it was on to the presidency--well, not quite",A chronological record of the events of successive years
"The name of this cylindrical vegetable means ""little squashes"" in Italian","""The bear band bears will play now in the good ol' key of G...""",Beneath the Vasco da Gama Bridge in Lisbon:This River,"Lemony Snicket should know this novelist penned ""Adverbs"" & ""Watch Your Mouth""","AKA ""Mad Max 2""","In the army, it's an order to move the troops forward, or for a soldier to move up in rank","""Top Gun"" & ""CSI"" are just two of the projects of this last of Hollywood's mega producers",A Latvian street?,"Francisco Goya: ""The 3rd of ____, 1808""","Called the first female M.D. in modern times, she helped found the London School of Medicine for Women in 1875","This stainless-steel car with gull-wing doors debuted in 1981; fewer than 10,000 were made","Gould, Miller or Ford"
